特价,原价,药名,厂家,规格,效期
券后约 ￥3.79,￥3.99,脑心舒口服液,湖北东信药业有限公司,规格：10ml*10支(管制玻璃瓶),效期：2022-08-31
券后约 ￥4.06,￥4.27,尿素维E乳膏,福元药业有限公司,规格：50g(15%),效期：2023-08-31
券后约 ￥4.54,￥4.78,注射用穿琥宁,成都天台山制药有限公司,规格：40mg*5支,效期：2022-08-11
券后约 ￥4.25,￥4.47,止咳枇杷颗粒,四川同人泰药业股份有限公司,规格：10g*12袋,效期：2022-02-28
券后约 ￥4.25,￥4.47,复方三七胶囊,吉林京辉药业股份有限公司,规格：0.25g*12粒*4板,效期：2022-09-30
券后约 ￥4.13,￥4.35,止咳枇杷颗粒,太极集团四川绵阳制药有限公司,规格：10g*9袋,效期：2022-09-30
券后约 ￥3.85,￥4.05,氨茶碱注射液,四川美大康华康药业有限公司,规格：10ml;0.25g*5支,效期：2021-09-30
券后约 ￥4.23,￥4.45,复方氨林巴比妥注射液,国药集团容生制药有限公司,规格：2ml*10支,效期：2022-01-31
券后约 ￥4.23,￥4.45,感冒退热颗粒,四川依科制药有限公司,规格：18g*8袋,效期：2022-03-31
券后约 ￥4.23,￥4.45,板蓝根颗粒,广东隆信制药有限公司,规格：5g*12袋,效期：2022-09-30
券后约 ￥4.18,￥4.40,盐酸氨溴索注射液,国药集团国瑞药业有限公司,规格：2ml:15mg*5支,效期：2021-10-31
券后约 ￥4.68,￥4.93,复合维生素B片,成都第一制药有限公司(原成都第一药业有限公司),规格：100片(600/件),效期：2022-06-30
券后约 ￥4.15,￥4.37,维生素E软胶囊,国药控股星鲨制药(厦门)有限公司,规格：50mg*60粒,效期：2023-06-30
券后约 ￥4.33,￥4.56,白葡萄球菌片,江苏神华药业有限公司,规格：40mg*100片,效期：2022-05-31
券后约 ￥4.43,￥4.66,丹皮酚软膏,长春英平药业有限公司,规格：15g,效期：2022-06-19
券后约 ￥4.48,￥4.72,伸筋丹胶囊,威海人生药业有限公司,规格：0.15g*60粒,效期：2022-06-30
券后约 ￥4.53,￥4.77,桑菊感冒颗粒,四川同人泰药业股份有限公司,规格：11g*10袋,效期：2022-09-30
券后约 ￥4.40,￥4.63,青霉素V钾片,海南三叶制药厂有限公司,规格：0.236g*12片*2板,效期：2022-06-30
券后约 ￥4.30,￥4.53,蛇胆川贝液,四川省通园制药集团有限公司,规格：10ml*6支,效期：2021-10-31
券后约 ￥4.34,￥4.57,川贝枇杷糖浆,昭通市骅成制药有限公司,规格：120ml,效期：2023-01-31
券后约 ￥4.91,￥5.17,复方氨林巴比妥注射液,西南药业股份有限公司,规格：2ml*10支,效期：2022-06-30
券后约 ￥4.91,￥5.17,缬沙坦分散片,山东益健药业有限公司,规格：80mg*7片,效期：2022-04-30
券后约 ￥4.91,￥5.17,心舒乐片,吉林双药药业集团有限公司,规格：0.3g*12片*3板,效期：2021-10-31
券后约 ￥4.91,￥5.17,断血流胶囊,芜湖张恒春药业有限公司,规格：0.35g*12粒*2板,效期：2022-08-31
券后约 ￥4.91,￥5.17,脑乐静,武汉太福制药有限公司,规格：200ml,效期：2022-07-31
券后约 ￥4.82,￥5.07,清眩片,太极集团重庆桐君阁药厂有限公司,规格：0.48g*50片,效期：2023-08-31
券后约 ￥4.82,￥5.07,非洛地平片,北京协和药厂,规格：5mg*20片,效期：2022-12-31
券后约 ￥4.72,￥4.97,感冒灵颗粒,广西两面针亿康药业股份有限公司,规格：10*9袋,效期：2022-02-28
券后约 ￥4.63,￥4.87,吡罗昔康片,云鹏医药集团有限公司(原山西云鹏制药有限公司),规格：10mg*100片,效期：2022-12-22
券后约 ￥4.62,￥4.86,氨茶碱注射液,河南润弘制药股份有限公司,规格：2ml:0.25g*10支,效期：2022-02-28
券后约 ￥4.69,￥4.94,通脉颗粒,四川逢春制药有限公司,规格：10g*10袋,效期：2022-07-31
券后约 ￥4.34,￥4.57,补肾强身片,太极集团四川绵阳制药有限公司,规格：100片(糖衣),效期：2023-01-31
券后约 ￥4.86,￥5.12,复方罗布麻片Ⅰ,云鹏医药集团有限公司(原山西云鹏制药有限公司),规格：100片(薄膜衣),效期：2021-11-08
券后约 ￥4.84,￥5.10,维生素E软胶囊,青岛双鲸药业股份有限公司,规格：100mg*60粒,效期：2022-06-18
券后约 ￥5.19,￥5.46,银黄颗粒,广东一片天医药集团制药有限公司,规格：4g*10袋,效期：2022-02-01
券后约 ￥5.19,￥5.46,感冒清片,广东恒诚制药股份有限公司/广东恒诚制药股份有限公司,规格：0.22g*100片(薄膜衣),效期：2022-11-30
券后约 ￥4.64,￥4.88,蛇胆川贝胶囊,江西川奇药业有限公司,规格：0.3g*12粒,效期：2023-09-30
券后约 ￥5.21,￥5.48,通脉颗粒,甘肃省金羚集团药业有限公司,规格：10g*10袋,效期：2023-07-31
券后约 ￥5.32,￥5.60,盐酸二甲双胍缓释片,山东明仁福瑞达制药股份有限公司,规格：0.5g*30片(薄膜衣),效期：2022-06-18
券后约 ￥5.36,￥5.64,对乙酰氨基酚片,四川省通园制药集团有限公司/四川省通园制药集团有限公司,规格：0.5g*100片,效期：2022-03-31
券后约 ￥5.41,￥5.69,氢溴酸右美沙芬口服溶液,江苏汉晨药业有限公司,规格：100ml(0.15%),效期：2022-03-31
券后约 ￥4.74,￥4.99,氨苄西林胶囊,昆明积大制药股份有限公司,规格：0.25g*20粒,效期：2021-09-08
券后约 ￥5.43,￥5.72,复方羊角颗粒,甘肃佛仁制药科技有限公司,规格：8g*12袋,效期：2022-06-30
券后约 ￥5.70,￥6.00,硫酸亚铁片,山西力玖药业有限公司,规格：0.3g*100片,效期：2023-08-31
,￥售罄,葡萄糖粉剂,康美保宁（四川）制药有限公司,规格：500g                                                        ,效期：
券后约 ￥5.42,￥5.70,抗感解毒颗粒,四川百草堂龙人药业有限公司,规格：10g*8袋,效期：2022-05-31
券后约 ￥5.42,￥5.70,当归调经颗粒,贵州威门药业股份有限公司,规格：10g*8袋,效期：2022-06-30
券后约 ￥5.42,￥5.70,多酶片,浙江国光生物制药有限公司,规格：100片,效期：2021-08-31
券后约 ￥5.42,￥5.70,丁硼乳膏,乐泰药业有限公司(原哈尔滨快好药业有限公司),规格：36g,效期：2022-06-30
券后约 ￥5.42,￥5.70,降糖胶囊,吉林玉仁制药股份有限公司,规格：0.3g*12粒*4板,效期：2022-12-06
券后约 ￥5.42,￥5.70,神曲胃痛胶囊,桂林南药股份有限公司,规格：0.4g*10粒*2板,效期：2021-10-10
券后约 ￥5.03,￥5.30,咳特灵胶囊,广州花城药业有限公司(原广州市花城制药厂),规格：30粒(瓶装),效期：
券后约 ￥5.30,￥5.58,安神补心片,太极集团四川绵阳制药有限公司,规格：100片,效期：2022-04-30
券后约 ￥5.50,￥5.79,辛伐他汀片,上海信谊万象药业股份有限公司,规格：10mg*10片(薄膜衣),效期：2022-07-01
券后约 ￥5.73,￥6.03,葡萄糖酸钙片,开封制药(集团)有限公司,规格：0.5g*100片,效期：2023-06-30
券后约 ￥5.36,￥5.64,玉屏风口服液,湖北济安堂药业股份有限公司,规格：10ml*10支,效期：2022-08-31
券后约 ￥5.90,￥6.21,萘敏维滴眼液,广东众生药业股份有限公司,规格：10ml                                                        ,效期：2022-04-19
券后约 ￥5.90,￥6.21,参麦注射液,四川升和药业股份有限公司,规格：2ml*10支,效期：2023-02-28
券后约 ￥5.80,￥6.11,硝苯地平缓释片(Ⅰ),浙江昂利康制药股份有限公司,规格：10mg*24片*2板,效期：2021-10-31
券后约 ￥5.33,￥5.61,替米沙坦片,海南赛立克药业有限公司,规格：20mg*14片,效期：2023-06-30
券后约 ￥5.99,￥6.31,复方丹参片,广东一力集团制药股份有限公司,规格：0.32g*100片(薄膜衣),效期：2022-02-28
券后约 ￥5.46,￥5.75,夏桑菊颗粒,四川康福来药业集团有限公司,规格：10g*20袋,效期：2022-03-31
券后约 ￥5.55,￥5.84,全天麻胶囊,贵州益康制药有限公司,规格：0.5g*12粒,效期：2023-06-30
券后约 ￥5.79,￥6.10,贝诺酯片,重庆和平制药有限公司,规格：0.5g*100片,效期：2022-05-31
券后约 ￥6.04,￥6.36,玉屏风口服液,湖北东信药业有限公司,规格：10ml*10支,效期：2022-07-31
券后约 ￥6.29,￥6.62,维生素C片,新乡市常乐制药有限责任公司,规格：0.1g*1000片,效期：2021-12-31
券后约 ￥6.44,￥6.78,贝诺酯片,重庆科瑞制药(集团)有限公司,规格：0.5g*100片,效期：2023-06-30
券后约 ￥6.11,￥6.43,橘红颗粒,广西玉兰制药有限公司,规格：11g*8袋,效期：2021-12-31
券后约 ￥6.20,￥6.53,小柴胡颗粒,九寨沟天然药业股份有限公司(原九寨沟天然药业集团有限责任公司）,规格：10g*10袋(120盒/件),效期：2022-03-31
券后约 ￥5.93,￥6.24,保心宁胶囊,四川省通园制药集团有限公司,规格：0.45g*12粒*2板,效期：2023-06-30
券后约 ￥6.30,￥6.63,苯磺酸氨氯地平片,江苏亚邦爱普森药业有限公司委托江苏亚邦强生药业有限公司生产,规格：5mg*14片,效期：2022-03-31
券后约 ￥6.45,￥6.79,氢溴酸右美沙芬片,北京天衡药物研究院南阳天衡制药厂,规格：15mg*12片*3板,效期：2022-01-31
券后约 ￥6.74,￥7.09,月见草油胶丸,国药集团武汉中联四药药业有限公司,规格：0.3g*40粒,效期：2021-10-31
券后约 ￥6.58,￥6.93,前列安通片,康县独一味生物制药有限公司,规格：0.38g*12片*3板,效期：2022-07-31
券后约 ￥6.58,￥6.93,复方石韦胶囊,黑龙江天翼药业有限公司,规格：0.3g*9粒*6板,效期：2022-07-04
券后约 ￥6.39,￥6.73,参芪颗粒,江西保利制药有限公司,规格：10g*10袋,效期：2022-07-30
券后约 ￥5.92,￥6.23,黄连上清丸,四川琦云药业有限责任公司,规格：6g*10袋(水丸)                                               ,效期：2023-04-30
券后约 ￥6.17,￥6.50,马来酸依那普利片,上海现代制药股份有限公司,规格：10mg*16片,效期：2023-04-30
券后约 ￥6.01,￥6.33,补中益气丸,药都制药集团股份有限公司,规格：9g*10丸,效期：2023-06-08
券后约 ￥6.74,￥7.10,酚氨咖敏片,重庆申高生化制药股份有限公司,规格：100片,效期：2022-09-16
券后约 ￥67.17,￥70.70,多维元素片(29-Ⅱ),惠氏制药有限公司,规格：60片,效期：2023-08-05
券后约 ￥6.50,￥6.84,骨肽片,安徽宏业药业有限公司,规格：12片*2板(薄膜衣),效期：2022-06-30
券后约 ￥6.93,￥7.30,夏桑菊颗粒,广东一力集团制药股份有限公司,规格：10g*20袋,效期：2023-04-30
券后约 ￥7.84,￥8.25,盐酸地芬尼多片,湖南千金湘江药业股份有限公司,规格：25mg*30片,效期：2023-06-30
券后约 ￥6.35,￥6.68,加替沙星滴眼液,安徽省双科药业有限公司,规格：5ml(0.3%),效期：2022-05-13
券后约 ￥6.87,￥7.23,格列齐特片,四川美大康药业股份有限公司,规格：80mg*48片,效期：2024-05-31
券后约 ￥18.99,￥19.99,多潘立酮片,西安杨森制药有限公司,规格：10mg*30片,效期：2025-02-28
券后约 ￥7.18,￥7.56,外用紫金锭,广州白云山敬修堂药业股份有限公司,规格：0.25g*18锭（450盒/件）,效期：2021-10-31
券后约 ￥11.11,￥11.70,呋塞米片,江苏亚邦爱普森药业有限公司,规格：20mg*100片,效期：2022-05-31
券后约 ￥3.59,￥3.78,尼莫地平片,亚宝药业集团股份有限公司,规格：20mg*50片,效期：2023-06-30
券后约 ￥6.89,￥7.25,风湿安泰片,通化茂祥制药有限公司,规格：12片*2板(糖衣),效期：2022-09-30
券后约 ￥7.55,￥7.95,马来酸依那普利片,湖南千金湘江药业股份有限公司,规格：10mg*16片,效期：2022-06-30
券后约 ￥6.89,￥7.25,小儿解感片,通化茂祥制药有限公司,规格：12片*2板(糖衣),效期：2022-01-31
券后约 ￥4.23,￥4.45,青霉素V钾片,西南药业股份有限公司,规格：0.236g*30片(薄膜衣),效期：2022-03-31
券后约 ￥6.57,￥6.92,格列吡嗪片,北京京丰制药集团有限公司,规格：5mg*15片*2板                                                ,效期：2022-03-15
券后约 ￥7.31,￥7.70,去痛片,华中药业股份有限公司,规格：100片,效期：2022-06-30
券后约 ￥97.47,￥102.60,多维元素片(29),惠氏制药有限公司,规格：100片,效期：2022-07-12
券后约 ￥7.04,￥7.41,六味地黄丸(浓缩丸),山东孔圣堂制药有限公司,规格：360丸,效期：2023-04-02
券后约 ￥21.47,￥22.60,孟鲁司特钠咀嚼片,四川大冢制药有限公司,规格：5mg*5片(300盒/件),效期：2022-02-26
券后约 ￥6.93,￥7.29,红花注射液,神威药业集团有限公司,规格：5ml*5支,效期：2023-06-30
券后约 ￥3.32,￥3.50,头孢克肟分散片,浙江莎普爱思药业股份有限公司,规格：0.1g*6片,效期：2022-02-12
券后约 ￥7.37,￥7.76,利巴韦林泡腾颗粒,天大药业(珠海)有限公司,规格：50mg*12袋,效期：2022-03-02
券后约 ￥10.92,￥11.50,雷贝拉唑钠肠溶片,山东新华制药股份有限公司,规格：10mg*8片,效期：2022-01-10
,￥售罄,清火片,天津同仁堂集团股份有限公司,规格：0.31g*20片*2板(薄膜衣)                                      ,效期：2022-01-31
券后约 ￥3.66,￥3.85,多潘立酮片,江西捷众制药有限公司,规格：10mg*30片,效期：2022-08-31
券后约 ￥7.09,￥7.46,格列齐特缓释片,安徽联谊药业股份有限公司,规格：30mg*15片*2板,效期：2022-06-25
券后约 ￥6.99,￥7.36,复方丹参片,吉林省长恒药业有限公司,规格：200片（薄膜衣）,效期：2023-06-30
券后约 ￥11.69,￥12.30,非洛地平缓释片,南京易亨制药有限公司,规格：5mg*20片,效期：2021-12-31
券后约 ￥6.39,￥6.73,盐酸二甲双胍缓释片,哈尔滨同一堂药业有限公司,规格：0.5g*30片,效期：2023-07-31
券后约 ￥40.56,￥42.70,格列齐特缓释片,施维雅(天津)制药有限公司,规格：30mg*30片,效期：2023-02-27
券后约 ￥6.58,￥6.93,肤痒颗粒,四川升和药业股份有限公司,规格：9g*10袋,效期：2022-02-28
券后约 ￥13.30,￥14.00,依巴斯汀片,江苏联环药业股份有限公司,规格：10mg*7片,效期：2022-07-31
券后约 ￥7.44,￥7.83,脑心舒口服液,通化金马药业集团股份有限公司,规格：10ml*10支(件装60),效期：2022-07-31
券后约 ￥11.07,￥11.65,金刚藤胶囊,湖北福人药业股份有限公司,规格：0.5g*24粒,效期：2022-08-23
券后约 ￥7.86,￥8.27,厄贝沙坦氢氯噻嗪分散片,江苏万高药业股份有限公司,规格：150mg:12.5mg*7片,效期：2022-02-28
券后约 ￥23.99,￥25.25,脑心通胶囊,陕西步长制药有限公司,规格：0.4g*36粒,效期：2022-04-30
券后约 ￥7.38,￥7.77,舒筋活血胶囊,杭州华东医药集团康润制药有限公司,规格：0.45g*12粒*2板                                              ,效期：2022-10-31
券后约 ￥21.12,￥22.23,胆舒胶囊,四川济生堂药业有限公司,规格：0.45g*30粒,效期：2022-08-31
券后约 ￥7.10,￥7.47,穿王消炎胶囊,江西青春康源制药有限公司,规格：0.4g*12粒*3板,效期：2022-03-25
券后约 ￥17.95,￥18.90,湿毒清胶囊,广西玉林制药集团有限责任公司,规格：0.5g*30粒,效期：2022-04-30
券后约 ￥8.05,￥8.47,缩泉丸,广东沙溪制药有限公司,规格：45g*1瓶,效期：2023-07-31
券后约 ￥27.41,￥28.85,血脂康胶囊,北京北大维信生物科技有限公司,规格：0.3g*24粒,效期：2022-07-31
券后约 ￥7.11,￥7.48,苯磺酸氨氯地平片,上海天赐福生物工程有限公司,规格：5mg*14片,效期：2022-05-19
券后约 ￥7.64,￥8.04,荆防颗粒,九寨沟天然药业股份有限公司(原九寨沟天然药业集团有限责任公司）,规格：15g*10袋,效期：2021-09-30
券后约 ￥1.61,￥1.70,奥美拉唑肠溶胶囊,四川科伦药业股份有限公司,规格：20mg*14粒,效期：2022-09-06
券后约 ￥7.64,￥8.04,格列齐特片,河南中杰药业有限公司,规格：80mg*60片,效期：2022-05-31
券后约 ￥5.13,￥5.40,麻仁丸,太极集团重庆桐君阁药厂有限公司,规格：6g*5袋,效期：2023-08-31
券后约 ￥7.83,￥8.24,硫软膏,国药集团三益药业(芜湖)有限公司,规格：20g(10%)                                                    ,效期：2023-04-30
券后约 ￥14.06,￥14.80,同仁乌鸡白凤丸,北京同仁堂股份有限公司同仁堂制药厂,规格：9g*10丸(100盒/件),效期：2023-08-31
券后约 ￥8.23,￥8.66,黄连上清丸,太极集团重庆中药二厂有限公司,规格：6g*10袋（浓缩水丸）                                         ,效期：2023-05-31
券后约 ￥27.36,￥28.80,右归丸,仲景宛西制药股份有限公司,规格：45g,效期：2023-06-30
券后约 ￥7.08,￥7.45,止嗽立效丸,山西华康药业股份有限公司,规格：6g*6袋,效期：2023-09-30
券后约 ￥7.59,￥7.99,血塞通片,湖南湘雅制药有限公司,规格：50mg*20片(薄膜衣),效期：2022-11-30
券后约 ￥7.50,￥7.89,降糖宁胶囊,通化茂祥制药有限公司,规格：0.4g*12粒*2板,效期：2021-12-31
券后约 ￥9.79,￥10.30,清脑复神液,广州花城药业有限公司,规格：10ml*6支,效期：2022-01-31
券后约 ￥7.50,￥7.89,复方门冬维甘滴眼液,广东众生药业股份有限公司,规格：10ml                                                        ,效期：2022-06-02
券后约 ￥16.63,￥17.50,茵栀黄口服液,北京华润高科天然药物有限公司,规格：10ml*6支,效期：2022-09-30
券后约 ￥22.32,￥23.50,蓝芩口服液,扬子江药业集团有限公司,规格：10ml*6支,效期：2022-07-31
券后约 ￥7.40,￥7.79,盐酸头孢他美酯片,成都倍特药业股份有限公司(成都倍特药业有限公司),规格：181.3mg*12片,效期：2022-03-09
券后约 ￥8.11,￥8.54,酞丁安乳膏,福元药业有限公司,规格：10g:0.3g（7g/支）,效期：2023-06-30
券后约 ￥3.61,￥3.80,利巴韦林颗粒,四川百利药业有限责任公司,规格：50mg*18袋,效期：2022-02-28
券后约 ￥8.36,￥8.80,复方感冒灵颗粒,广西宝瑞坦制药有限公司,规格：14g*11袋                                                    ,效期：2022-02-28
券后约 ￥11.92,￥12.55,小儿七星茶颗粒,广州王老吉药业股份有限公司,规格：7g*10袋,效期：2023-04-30
券后约 ￥8.40,￥8.84,盐酸倍他司汀口服液,四川宝鉴堂药业有限公司,规格：10ml：20mg*10支,效期：2022-02-14
券后约 ￥7.59,￥7.99,头孢克肟颗粒,国药集团致君(深圳)制药有限公司,规格：50mg*6包,效期：2022-08-31
券后约 ￥5.22,￥5.50,姜枣祛寒颗粒,福建省泉州罗裳山制药厂,规格：15g*10袋(100/件),效期：2022-06-30
券后约 ￥8.40,￥8.84,珍菊降压片,亚宝药业集团股份有限公司,规格：60片,效期：2023-08-31
券后约 ￥9.09,￥9.57,头孢呋辛酯片,国药集团致君(深圳)制药有限公司,规格：0.25g*12片(薄膜衣),效期：2023-09-30
券后约 ￥5.13,￥5.40,小儿清肺化痰颗粒,北京长城制药有限公司,规格：6g*6袋,效期：2021-11-30
券后约 ￥20.61,￥21.70,连花清瘟颗粒,北京以岭药业有限公司,规格：6g*10袋,效期：2022-11-30
券后约 ￥9.32,￥9.81,氨甲苯酸注射液,湖南洞庭药业股份有限公司,规格：10ml：0.1g*5支                                              ,效期：2023-05-31
券后约 ￥8.37,￥8.81,单硝酸异山梨酯片,辰欣药业股份有限公司,规格：20mg*48片,效期：2022-03-22
券后约 ￥17.15,￥18.05,曲安奈德益康唑乳膏,西安杨森制药有限公司,规格：15g,效期：2022-06-30
券后约 ￥9.07,￥9.55,盐酸利多卡因注射液,重庆迪康长江制药有限公司,规格：5ml:0.1g*5支,效期：2022-11-28
券后约 ￥9.06,￥9.54,甘草锌胶囊,湖南千金湘江药业股份有限公司,规格：0.25g*24粒,效期：2022-06-30
券后约 ￥14.72,￥15.50,洁尔阴洗液,四川恩威制药有限公司,规格：280ml,效期：2024-06-30
券后约 ￥8.85,￥9.32,强力枇杷露,贵州神奇药业有限公司,规格：120ml,效期：2022-02-28
券后约 ￥8.85,￥9.32,盐酸氨基葡萄糖胶囊,北京葡立药业有限公司,规格：0.24g*24粒,效期：2022-10-31
券后约 ￥7.22,￥7.60,正骨水,广西玉林制药集团有限责任公司,规格：12ml,效期：2022-11-30
券后约 ￥8.85,￥9.32,赖氨葡锌颗粒,沈阳东新药业有限公司,规格：15袋,效期：2022-11-28
券后约 ￥9.24,￥9.73,地氯雷他定片,广东九明制药有限公司,规格：5mg*6片*2板,效期：2022-06-30
券后约 ￥9.12,￥9.60,麝香祛痛搽剂,马应龙药业集团股份有限公司,规格：56ml,效期：2022-03-31
券后约 ￥9.01,￥9.48,复方穿心莲片,广西北部湾制药股份有限公司,规格：100片*10袋(糖衣),效期：2022-06-30
券后约 ￥5.42,￥5.70,复方感冒灵片,广州花城药业有限公司,规格：100片(薄膜衣),效期：2022-02-28
,￥售罄,复方盐酸伪麻黄碱缓释胶囊,中美天津史克制药有限公司,规格：8粒,效期：
券后约 ￥7.36,￥7.75,三黄片,河南省百泉制药有限公司,规格：18片*10袋(糖衣),效期：2023-04-30
券后约 ￥8.20,￥8.63,葡萄糖酸锌口服溶液,湖北纽兰药业有限公司,规格：10ml*14支,效期：2022-07-31
券后约 ￥4.37,￥4.60,复方草珊瑚含片,江中药业股份有限公司,规格：0.44g*48片,效期：2021-08-31
券后约 ￥9.21,￥9.69,酚氨咖敏颗粒,神威药业集团有限公司,规格：5g*20袋（盒装）,效期：2022-06-30
券后约 ￥7.55,￥7.95,银黄含片,成都地奥制药集团有限公司,规格：0.65g*24片,效期：2022-03-26
券后约 ￥9.35,￥9.84,转移因子胶囊,南京海鲸药业有限公司,规格：3mg*24粒,效期：2022-07-31
券后约 ￥6.37,￥6.70,天麻头痛片,黑龙江乌苏里江制药有限公司哈尔滨分公司,规格：48片(糖衣),效期：2022-08-31
券后约 ￥8.46,￥8.90,左炔诺孕酮片,华润紫竹药业有限公司,规格：0.75mg*2片,效期：2025-05-15
券后约 ￥9.31,￥9.80,盐酸倍他司汀口服液,黑龙江中桂制药有限公司,规格：10ml*9支,效期：2022-03-11
,￥您的含麻委托书已过期，请联系客服处理,复方桔梗麻黄碱糖浆(Ⅱ),贵州百灵企业集团制药股份有限公司,规格：100ml,效期：
券后约 ￥10.92,￥11.50,螺内酯片,杭州民生药业有限公司,规格：20mg*100片(件装200),效期：2023-06-30
券后约 ￥5.32,￥5.60,复方对乙酰氨基酚片(Ⅱ),西南药业股份有限公司,规格：10片,效期：2025-04-30
券后约 ￥9.92,￥10.44,格列美脲片,江苏万邦生化医药集团有限责任公司,规格：1mg*12片*2板                                                ,效期：2022-08-31
券后约 ￥9.59,￥10.09,盐酸氯丙嗪片,广东彼迪药业有限公司,规格：25mg*100片,效期：2022-07-03
券后约 ￥10.64,￥11.20,复方磺胺甲噁唑片,北大医药股份有限公司,规格：100片,效期：2024-02-28
券后约 ￥9.35,￥9.84,盐酸利多卡因注射液,西南药业股份有限公司委托太极集团四川太极制药有限公司生产,规格：5ml：0.1g*5支,效期：2022-03-31
券后约 ￥87.88,￥92.50,枸橼酸西地那非片,辉瑞制药有限公司,规格：0.1g*1片,效期：2024-12-31
券后约 ￥9.35,￥9.84,五维赖氨酸颗粒,南京厚生药业有限公司,规格：5g*8袋                                                      ,效期：2021-12-31
券后约 ￥48.16,￥50.70,叶酸片,北京斯利安药业有限公司,规格：0.4mg*93片,效期：2023-04-30
券后约 ￥8.87,￥9.34,布洛芬混悬液,天大药业(珠海)有限公司,规格：60ml*1.2g,效期：2023-01-08
券后约 ￥13.77,￥14.50,盐酸二甲双胍缓释片,成都恒瑞制药有限公司,规格：0.5g*10片*3板(薄膜衣),效期：2022-07-15
券后约 ￥13.30,￥14.00,瑞舒伐他汀钙片,浙江京新药业股份有限公司,规格：10mg*6片,效期：2022-02-28
券后约 ￥8.78,￥9.24,格列吡嗪片,海南赞邦制药有限公司(海南金晓),规格：5mg*30片,效期：2021-11-30
券后约 ￥1.42,￥1.50,乙酰螺旋霉素片,四川制药制剂有限公司,规格：0.1g*12片(件装1000)(薄膜衣),效期：2023-02-28
券后约 ￥10.40,￥10.95,复方鲜竹沥液,江西汇仁药业股份有限公司,规格：10ml*6支,效期：2022-08-31
券后约 ￥18.81,￥19.80,脂必泰胶囊,成都地奥九泓制药厂,规格：0.24g*10粒,效期：2022-07-15
券后约 ￥9.45,￥9.95,盐酸二甲双胍缓释片,成都恒瑞制药有限公司,规格：0.5g*10片*2板(薄膜衣),效期：2021-09-28
券后约 ￥15.67,￥16.50,镇脑宁胶囊,通化东宝药业股份有限公司,规格：0.3g*60粒(件装100),效期：2023-04-30
券后约 ￥9.83,￥10.35,强力天麻杜仲胶囊,贵州三力制药股份有限公司（贵州三力制药有限责任公司,规格：0.4g*24粒,效期：2022-07-02
券后约 ￥9.83,￥10.35,复方氨基酸注射液(18AA)25g,广东利泰制药股份有限公司,规格：500ml:25g,效期：2022-06-30
券后约 ￥85.69,￥90.20,排毒养颜胶囊,云南盘龙云海药业有限公司,规格：0.4g*70粒,效期：2023-06-30
券后约 ￥9.64,￥10.15,肝宁片,通化茂祥制药有限公司,规格：12片*2板(糖衣),效期：2022-03-31
券后约 ￥25.63,￥26.98,多糖铁复合物胶囊,上海医药集团青岛国风药业股份有限公司,规格：0.15g*10粒,效期：2023-04-30
券后约 ￥9.07,￥9.55,布洛芬混悬液,扬州市三药制药有限公司,规格：25ml:0.5g*4瓶,效期：2022-07-31
券后约 ￥25.17,￥26.50,通宣理肺丸,太极集团四川绵阳制药有限公司,规格：6g*50袋(每10丸重0.5g(水丸),效期：2023-03-31
券后约 ￥9.07,￥9.55,糖脉康颗粒,四川宝鉴堂药业有限公司（原四川升和药业股份有限公司）,规格：5g*10袋,效期：2022-04-30
